Наименование,Цена,Ссылка
Подвесной светильник Ферум Orange,4990,https://www.divan.ru/product/podvesnoj-svetilnik-ferum-orange
Светильник потолочный Ринга Black,2490,https://www.divan.ru/product/svetilnik-potolochnyj-ringa-black
Торшер Бьйорк White,8490,https://www.divan.ru/product/torsher-bjork-white
Подвесной светильник Тубули-5 Wood,9490,https://www.divan.ru/product/podvesnoj-svetilnik-tubuli-5-wood
Бра Смастен White,4990,https://www.divan.ru/product/bra-smasten-white
Настольная лампа Арвика Wood,5990,https://www.divan.ru/product/nastolnaya-lampa-arvika-wood
Подвесной светильник Инлада Wood,6990,https://www.divan.ru/product/podvesnoj-svetilnik-inlada-wood
Подвесной светильник Намсен Black,7990,https://www.divan.ru/product/podvesnoj-svetilnik-namsen-black
Торшер Алней-2 White,6990,https://www.divan.ru/product/torsher-alnej-2-white
Люстра Ливсден Brown,18990,https://www.divan.ru/product/lyustra-livsden-brown
Подвесной светильник Гронтри-1 Wood,9990,https://www.divan.ru/product/podvesnoj-svetilnik-grontri-1-wood
Бра Бракетт White,4990,https://www.divan.ru/product/bra-brakett-white
Подвесной светильник Отра Wood,12490,https://www.divan.ru/product/podvesnoj-svetilnik-otra-wood
Торшер Алней-2 Black,6990,https://www.divan.ru/product/torsher-alnej-2-black
Светильник потолочный Орхус White,16990,https://www.divan.ru/product/svetilnik-potolochnyj-orhus-white
Торшер Раффи Round,12990,https://www.divan.ru/product/torsher-raffi-round
Подвесной светильник Рена Green,3490,https://www.divan.ru/product/podvesnoj-svetilnik-rena-green
Светильник потолочный Ринга White,2690,https://www.divan.ru/product/svetilnik-potolochnyj-ringa-white
Настольная лампа Логмар Black,6990,https://www.divan.ru/product/nastolnaya-lampa-logmar-black
Бра Берит Black,5990,https://www.divan.ru/product/bra-berit-black
Подвесной светильник Кронор Black,7990,https://www.divan.ru/product/podvesnoj-svetilnik-kronor-black
Настольная лампа Бьйорк White,3990,https://www.divan.ru/product/nastolnaya-lampa-bjork-white
Подвесной светильник Селау-2 Glass,3490,https://www.divan.ru/product/podvesnoj-svetilnik-selau-2-glass
Торшер Алней-2 Green,6990,https://www.divan.ru/product/torsher-alnej-2-green
Подвесной светильник Джамби Rattan,9990,https://www.divan.ru/product/podvesnoj-svetilnik-djambi-rattan
Бра Пинна Black,4990,https://www.divan.ru/product/bra-pinna-black
Подвесной светильник Бьйорк White,5490,https://www.divan.ru/product/podvesnoj-svetilnik-bjork-white
Торшер Осло Blue,17990,https://www.divan.ru/product/torsher-oslo-blue
Настольная лампа Чэд Black,3990,https://www.divan.ru/product/nastolnaya-lampa-ched-black
Бра Бьйорк White,2990,https://www.divan.ru/product/bra-bjork-white
Подвесной светильник Арвика Wood,5490,https://www.divan.ru/product/podvesnoj-svetilnik-arvika-wood
Подвесной светильник Бенфлит Black,6990,https://www.divan.ru/product/podvesnoj-svetilnik-benflit-black
Светильник потолочный Орхус Black,11990,https://www.divan.ru/product/svetilnik-potolochnyj-orhus-black
Торшер Алней-2 Orange,6990,https://www.divan.ru/product/torsher-alnej-2-orange
Настольная лампа Сканди White,4990,https://www.divan.ru/product/nastolnaya-lampa-skandi-white
Подвесной светильник Ливсден Brown,4990,https://www.divan.ru/product/podvesnoj-svetilnik-livsden-brown
Настольная лампа Филикс Black,3990,https://www.divan.ru/product/nastolnaya-lampa-filiks-black
Подвесной светильник Бейла Black,4290,https://www.divan.ru/product/podvesnoj-svetilnik-bejla-black
Светильник потолочный Лаго White,8490,https://www.divan.ru/product/svetilnik-potolochnyj-lago-white
Подвесной светильник Чинкве Silver,4290,https://www.divan.ru/product/podvesnoj-svetilnik-chinkve-silver
Торшер Энкель Black,5990,https://www.divan.ru/product/torsher-enkel-black
Люстра Малинг Multi,17990,https://www.divan.ru/product/lyustra-maling-multi
Подвесной светильник Джамби-1 Rattan,6490,https://www.divan.ru/product/podvesnoj-svetilnik-djambi-1-rattan
Подвесной светильник Селау-1 Glass,3490,https://www.divan.ru/product/podvesnoj-svetilnik-selau-1-glass
Подвесной светильник Ферум Black,2490,https://www.divan.ru/product/podvesnoj-svetilnik-ferum-black
Бра Смастен Black,3490,https://www.divan.ru/product/bra-smasten-black
Подвесной светильник Кронор White,5490,https://www.divan.ru/product/podvesnoj-svetilnik-kronor-white
Подвесной светильник Тубули Wood,2290,https://www.divan.ru/product/podvesnoj-svetilnik-tubuli-wood
Настольная лампа Требен White,3990,https://www.divan.ru/product/nastolnaya-lampa-treben-white
Подвесной светильник Ферум Grey,2490,https://www.divan.ru/product/podvesnoj-svetilnik-ferum-grey
Подвесной светильник Квина Black,6990,https://www.divan.ru/product/podvesnoj-svetilnik-kvina-black
Подвесной светильник Бейла White,4290,https://www.divan.ru/product/podvesnoj-svetilnik-bejla-white
Торшер Рэй Black,5290,https://www.divan.ru/product/torsher-rej-black
Подвесной светильник Гронтри Wood,7490,https://www.divan.ru/product/podvesnoj-svetilnik-grontri-wood
Подвесной светильник Скара Wood,2990,https://www.divan.ru/product/podvesnoj-svetilnik-skara-wood
Настольная лампа Гросс White,4990,https://www.divan.ru/product/nastolnaya-lampa-gross-white
Подвесной светильник Чинкве Gold,4290,https://www.divan.ru/product/podvesnoj-svetilnik-chinkve-gold
Подвесной светильник Гронтри-2 Wood,13990,https://www.divan.ru/product/podvesnoj-svetilnik-grontri-2-wood
Подвесной светильник Фюн White,3290,https://www.divan.ru/product/podvesnoj-svetilnik-fyun-white
Подвесной светильник Рена White,2490,https://www.divan.ru/product/podvesnoj-svetilnik-rena-white
Подвесной светильник Чинкве Gray,4490,https://www.divan.ru/product/podvesnoj-svetilnik-chinkve-gray
Подвесной светильник Селау Glass,4290,https://www.divan.ru/product/podvesnoj-svetilnik-selau-glass
Подвесной светильник Исбит Transparent,5490,https://www.divan.ru/product/podvesnoj-svetilnik-isbit-transparent
Торшер Осло Black,16990,https://www.divan.ru/product/torsher-oslo-black
Настольная лампа Астри Beige,1290,https://www.divan.ru/product/nastolnaya-lampa-astri-beige
Бра Бракетт Black,4990,https://www.divan.ru/product/bra-brakett-black
Подвесной светильник Клауд White,10990,https://www.divan.ru/product/podvesnoj-svetilnik-klaud-white
Настольная лампа Спайк Pink,990,https://www.divan.ru/product/nastolnaya-lampa-spajk-pink
Настольная лампа Рибе Orange,2990,https://www.divan.ru/product/nastolnaya-lampa-ribe-orange
Люстра Боллар White,22990,https://www.divan.ru/product/lyustra-bollar-white
Настольная лампа Истад Black,2290,https://www.divan.ru/product/nastolnaya-lampa-istad-black
Настольная лампа Синдри Grey,4990,https://www.divan.ru/product/nastolnaya-lampa-sindri-grey
Настольная лампа Манэт White,2990,https://www.divan.ru/product/nastolnaya-lampa-manet-white
Настольная лампа Леррет White,2990,https://www.divan.ru/product/nastolnaya-lampa-lerret-white
Подвесной светильник Лечче Black,3290,https://www.divan.ru/product/podvesnoj-svetilnik-lechche-black
Настольная лампа Арбет Silver,2490,https://www.divan.ru/product/nastolnaya-lampa-arbet-silver
Настольная лампа Гейза Blue,2490,https://www.divan.ru/product/nastolnaya-lampa-gejza-blue
Люстра Гейза Black,10990,https://www.divan.ru/product/lyustra-gejza-black
Торшер Флиммер Black,5290,https://www.divan.ru/product/torsher-flimmer-black
Настольная лампа Ливсден Brown,8990,https://www.divan.ru/product/nastolnaya-lampa-livsden-brown
Настольная лампа Спайк White,990,https://www.divan.ru/product/nastolnaya-lampa-spajk-white
Подвесной светильник Малинг Beige,6990,https://www.divan.ru/product/podvesnoj-svetilnik-maling-beige
Подвесной светильник Малинг Orange,6690,https://www.divan.ru/product/podvesnoj-svetilnik-maling-orange
Настольная лампа Рибе Black,1990,https://www.divan.ru/product/nastolnaya-lampa-ribe-black
Настольная лампа Снибальд White,690,https://www.divan.ru/product/nastolnaya-lampa-snibald-white
Подвесной светильник Сансет Black,5990,https://www.divan.ru/product/podvesnoj-svetilnik-sanset-black
Настольная лампа Арбет White,1690,https://www.divan.ru/product/nastolnaya-lampa-arbet-white
Настольная лампа Гейза Orange,3990,https://www.divan.ru/product/nastolnaya-lampa-gejza-orange
Бра Флиммер Black,1990,https://www.divan.ru/product/bra-flimmer-black
Настольная лампа Гейза Pink,2490,https://www.divan.ru/product/nastolnaya-lampa-gejza-pink
Настольная лампа Арбет Orange,2690,https://www.divan.ru/product/nastolnaya-lampa-arbet-orange
Подвесной светильник Бабл-9,22590,https://www.divan.ru/product/podvesnoj-svetilnik-babl-9
Люстра Флиммер Black,6490,https://www.divan.ru/product/lyustra-flimmer-black
Настольная лампа Гейза Black,3990,https://www.divan.ru/product/nastolnaya-lampa-gejza-black
Настольная лампа Арбет Beige,2690,https://www.divan.ru/product/nastolnaya-lampa-arbet-beige
Подвесной светильник Флиммер Black,1990,https://www.divan.ru/product/podvesnoj-svetilnik-flimmer-black
Настольная лампа Флиммер Black,3290,https://www.divan.ru/product/nastolnaya-lampa-flimmer-black
Настольная лампа Истад White,2290,https://www.divan.ru/product/nastolnaya-lampa-istad-white
Настольная лампа Дэнди White,4490,https://www.divan.ru/product/nastolnaya-lampa-dendi-white
Настольная лампа Алней Green,4990,https://www.divan.ru/product/nastolnaya-lampa-alnej-green
Подвесной светильник Бабл-3,7590,https://www.divan.ru/product/podvesnoj-svetilnik-babl-3
Бра Бабл Black,2490,https://www.divan.ru/product/bra-babl-black
Настольная лампа Дэнди Black,4490,https://www.divan.ru/product/nastolnaya-lampa-dendi-black
Торшер Варио White,7990,https://www.divan.ru/product/torsher-vario-white
Бра Варио Black,1190,https://www.divan.ru/product/bra-vario-black
Подвесной светильник Кэндел White,2490,https://www.divan.ru/product/podvesnoj-svetilnik-kendel-white
Настольная лампа Рэй Black,3990,https://www.divan.ru/product/nastolnaya-lampa-rej-black
Торшер Билли White,19990,https://www.divan.ru/product/torsher-billi-white
Бра Bolla-Unica,5290,https://www.divan.ru/product/bra-bolla-unica
Настольная лампа Moderli Suspent,4990,https://www.divan.ru/product/nastolnaya-lampa-moderli-suspent
Торшер Moderli Suspent,7990,https://www.divan.ru/product/torsher-moderli-suspent
Подвесной светильник Narices-1,30290,https://www.divan.ru/product/podvesnoj-svetilnik-narices-1
Подвесной светильник Кая Black,2990,https://www.divan.ru/product/podvesnoj-svetilnik-kaya-black
Подвесной светильник Талли Black,7490,https://www.divan.ru/product/podvesnoj-svetilnik-talli-black
Подвесной светильник Ридж Grey,3490,https://www.divan.ru/product/podvesnoj-svetilnik-ridj-grey
Подвесной светильник Ридж White,3290,https://www.divan.ru/product/podvesnoj-svetilnik-ridj-white
Бра Брик Black,4190,https://www.divan.ru/product/bra-brik-black
Торшер Moderli Floor White,7990,https://www.divan.ru/product/torsher-moderli-floor-white
Настольная лампа Junior-2,3190,https://www.divan.ru/product/nastolnaya-lampa-junior-2
Бра Равелло Black,5890,https://www.divan.ru/product/bra-ravello-black
Настольная лампа Алней Orange,4990,https://www.divan.ru/product/nastolnaya-lampa-alnej-orange
Настольная лампа Спайк Green,1390,https://www.divan.ru/product/nastolnaya-lampa-spajk-green
Настольная лампа Нидлс Raffia Beige,5990,https://www.divan.ru/product/nastolnaya-lampa-nidls-raffia-beige
Торшер Нидлс Khaki,15990,https://www.divan.ru/product/torsher-nidls-khaki
Настольная лампа Спайк Orange,1390,https://www.divan.ru/product/nastolnaya-lampa-spajk-orange
Настольная лампа Требен Orange,3990,https://www.divan.ru/product/nastolnaya-lampa-treben-orange
Настольная лампа Клауд White,15990,https://www.divan.ru/product/nastolnaya-lampa-klaud-white
Настольная лампа Леррет Beige,4990,https://www.divan.ru/product/nastolnaya-lampa-lerret-beige
Подвесной светильник Портланд Black,3990,https://www.divan.ru/product/podvesnoj-svetilnik-portland-black
Торшер Гросс White,7990,https://www.divan.ru/product/torsher-gross-white
Торшер Клауд White,18990,https://www.divan.ru/product/torsher-klaud-white
Настольная лампа Сфера Black,5990,https://www.divan.ru/product/nastolnaya-lampa-sfera-black
Торшер Портланд Black,7990,https://www.divan.ru/product/torsher-portland-black
Торшер Осло White,16990,https://www.divan.ru/product/torsher-oslo-white
Торшер Алней Black,8990,https://www.divan.ru/product/torsher-alnej-black
Торшер Ливсден Brown,11990,https://www.divan.ru/product/torsher-livsden-brown
Подвесной светильник Малинг Olive,6690,https://www.divan.ru/product/podvesnoj-svetilnik-maling-olive
Торшер Алней Green,8990,https://www.divan.ru/product/torsher-alnej-green
Торшер Логмар Silver,19990,https://www.divan.ru/product/torsher-logmar-silver
Торшер Омаха White,9590,https://www.divan.ru/product/torsher-omaha-white
Торшер Сканди White,10990,https://www.divan.ru/product/torsher-skandi-white
Подвесной светильник Moderli Host-1,4990,https://www.divan.ru/product/podvesnoj-svetilnik-moderli-host-1
Настольная лампа Шоу Black,6990,https://www.divan.ru/product/nastolnaya-lampa-shou-black
Торшер Алней Beige,8990,https://www.divan.ru/product/torsher-alnej-beige
Настольная лампа Раффи Round,6990,https://www.divan.ru/product/nastolnaya-lampa-raffi-round
Торшер Логмар Black,21990,https://www.divan.ru/product/torsher-logmar-black
Настольная лампа Отто Black,4790,https://www.divan.ru/product/nastolnaya-lampa-otto-black
Настольная лампа Флейк White,7990,https://www.divan.ru/product/nastolnaya-lampa-flejk-white
Торшер Шоу Black,11990,https://www.divan.ru/product/torsher-shou-black
Настольная лампа Сфера Orange,5990,https://www.divan.ru/product/nastolnaya-lampa-sfera-orange
Подвесной светильник Бабл Quartz,11490,https://www.divan.ru/product/podvesnoj-svetilnik-babl-quartz
Торшер Флейк White,13190,https://www.divan.ru/product/torsher-flejk-white
